Kimberly Kaye Terry	Get Your Sexy On	10.36	5.18	2.59		Aphrodisia	October 1, 2008	10	4	0		English	0758222505	978-0758222503	paperback	304	The men crowd in and howl for more when Sin\'s on stage - she knows just how to work it, wrapping her lithe body around the pole to dance down and dirty. But Sin doesn\'t see them, lost in a world of her own...until sexy private investigator \'Mac\' Garret McAllister steps into the club.In one night of erotic passion, the man turns her world upside down. Mac pays homage to her beautiful body with delicious, carnal ferocity. When the sun comes up, she cuts out. She can\'t let him get too close to her heart...But two years later, they reunite.  Still on fire for her, Mac is ready to do whatever it takes to ensure his woman stays right where she belongs - in his arms and his bed. Forever this time.	''	Romance	''
Tess Mallory	Highland Rebel	6.99	3.50	1.75		Berkley	March 3, 2009	13	1	0		English	0425226352	978-0425226353	paperback	304	Meet the irresistible Highland Rebel... He\'s music\'s hottest pop idol, a Celtic bad boy whose tradition-drenched rock rules the charts. But Ian MacGregor hails from 18th-century Scotland. And nothing can make him return except perhaps a certain blue-eyed lassie. Ellie Graham is his tour manager. But when she\'s swept back almost 300 years into the past and into treachery, only Ian--and his passion--can save her.	''	Romance	''
Christie Craig , Faye Hughes	The Everything Guide to Writing a Romance Novel: From writing the perfect love scene to finding the right publisher--All you need to fulfill your dreams	10.85	5.42	2.71		Adams Media	September 17, 2008	7	1	0		English	1598695371	978-1598695373	paperback	320	Every year, thousands of romance manuscripts are submitted to publishers, but only the best are eventually published. This simple guide--written by two awardwinning romance novelists--will show readers what it takes to break into this highly competitive market and will provide them the information they need to get their manuscript out of the slush pile and onto the bookshelf. Readers will learn how to do the following techniques: build a story from premise to plot; add a fresh twist to a classic storyline; create compelling characters; write sizzling sex scenes that carry an emotional punch; research agents and markets; write a story that an editor can\'t reject; and promote themselves and their work. New writers, and even experienced writers, will find the solid howto information here invaluable. This is a musthave for aspiring writers who want to write the perfect love story.	Everything Series	Romance	''
Anonymous Anonymous	The Romance of Lust	16.47	8.23	4.12		Olympia Press	November 25, 2008	4	0	0		English	159654032X	978-1596540323	paperback	402	The complete account of Charlie Roberts, his family, his servants, his boarding school chums, his wife and his travels. In one olume.	''	Romance	''
Leah Brooke	Desire for Three [Desire, Oklahoma 1]	13.49	6.75	3.37		Siren Publishing, Inc.	November 6, 2008	13	0	0		English	1606012398	978-1606012390	paperback	228	DESIRE FOR THREE [Siren Menage Amour #15: Erotic Contemporary, Menage a Trois Romance, M/F/M, with Dom/sub BDSM] With her fortieth birthday approaching and a bad marriage behind her, Jessica Tyler wants a fresh start.  Marriage left her an emotionless shell and she ows never to get involved with a man again. Giving in to her sister, Jesse agrees to isit her in Desire, Oklahoma. But Desire is a small town unlike any other. Dom/sub and menage relationships are the norm in a town where ranchers and cowboys adore and protect their women in ways that leave Jesse...fascinated. She\'s first intrigued, then alarmed when two gorgeous over-protective brothers, Clay and Rio Erickson, rush to claim her for their own. Yanked from her protective shell, threatened by her ex, Jesse is determined to stay strong, even as her two formidable lovers are intent on possessing her. Will her independence be smothered or will love give her the strength to change all three of their lives forever? *** \"I\'ve always loved alpha males who know how to treat a woman. Of course, such men would have ery strong ideas of what they want and how to get it. Those who are Doms or want a menage relationship may want to live where such things were the norm. And what woman wouldn\'t want to live where they\'re adored?\" ~ Leah ~ *** 5 Blue Ribbons: \"Desire for Three is the first book in Leigh Brooks\' DESIRE, OKLAHOMA series. A series involving a small town in Oklahoma founded entirely by people who had a \'desire\' to live their lives as they choose without being judged by others in the community. I have to admit, I love this idea. As I read this book I couldn\'t help but feel a little envious.  The men\'s adoration of the women in their lives and the protectiveness of every woman in the community really endeared this story to me. There\'s simply a sense of happiness in just being \'you\' that really captured my attention. Jesse, Clay and Rio are a wonderful trio who all deserve a happily-ever-after and kept me enthralled in each and every page of this storyline. I\'ll now be eagerly awaiting the next story in this series - Blade\'s Desire, which is Kelly and of course, Blade\'s story. She was abused in her former relationship and Blade, a Dom, has his eyes set on her. From the sparks flying between these two in this story it should really be interesting to learn how they come together.\" -- Chrissy Dionne, Romance Junkies Reviews	''	Romance	''
Julia Latham	Taken and Seduced	6.99	3.50	1.75		Avon	March 31, 2009	4	0	0		English	0061433004	978-0061433009	paperback	384	He was seeking justice for those he loved . . .  Adam Hilliard, secret Earl of Keswick, lives for one thing: To kill the man who slew his parents. Raised in secrecy by the League of the Blade, he would do anything to restore his family\'s honor.  She was desperate to escape propriety . . .  Lady Florence Becket is the key to his revenge. But when he kidnaps her, Florrie is neither frightened nor furious, as most other young ladies would be. The bold and powerful stranger who spirited her from her father\'s castle could give her the freedom and adventure she craves.  They would find far more than they ever desired . . .  She is moved by his quest. He is captivated by her courage. They have no defense against the passion ignited by a single kiss. Adam has taken her from all she\'s ever knownbut now Florrie will delight in her scandalous seduction.	''	Romance	''
Hayat Ali	The Alpha Promise	15.99	8.00	4.00		BookSurge Publishing	January 14, 2009	11	1	0		English	1439211841	978-1439211847	paperback	324	Wonderfully sublime and altogether sexy, The Alpha Promise by Hayat Ali reinvigorates the tired genre of ampire tales. While the enticing action and bloodletting remains, this debut novel takes a smart look at the undead--their legions and their way of life. It is not at all as simple and unplanned as one might imagine. Vampires have a method, and even in a modern day London, the undead still have a high prince who ubiquitously rules over all the creatures of the night just as he has for centuries. Jin is the most recent prince due to be crowned; he has been groomed for an entire lifetime. Poised to take his rightful place, a dissenting tribe tries to assassinate him and if it wasn\'t for the unwitting energies of a compassionate stranger--an American woman named Adina Carr--the tribe would have succeeded. What follows is an erotic and mesmerizing adventure, a fight for survival and, ultimately, a love story.	''	Romance	''
Laura Corn	101 Nights of Grrreat Romance: Secret Sealed Seductions for Fun-Loving Couples	22.76	17.07	11.38	5.69	Park Avenue Publishers	December 1996	11	3	5	1	English	0962962821	978-0962962820	hardcover	389	This is the first and only book filled with secret sealed recipes for romance--half for men and half for women. Because they\'re sealed, neither party has any idea what the other is planning--but sometime during the week, each will surprise the other with a sweet seduction.	''	Romance	''
Cynthia Breeding	My Noble Knight	4.99	2.50	1.25		Zebra	June 1, 2007	13	2	1		English	082178031X	978-0821780312	paperback	384	Daughter of a high priestess of the bloodline of Mary Magdalene, Deidre of the Languedoc sets out in search of the Philosopher\'s Stone which an old magician stole from its shrine, leaving in its place a book about some place called Camelot. She is duty-bound to find the Stone, but her woman\'s heart hopes to find one of those noble knights as well.	Zebra Historical Romance	Romance	''
Nina Bangs	The Pleasure Master	6.99	3.50	1.75		Love Spell	August 30, 2005	7	0	0		English	0505524457	978-0505524454	paperback	368	A ery special man is now available.  The Pleasure Master. A man who knows the secrets of a woman\'s body, who can bring her sensual joy and fulfill her deepest sexual fantasies. Is there a woman alive who wouldn\'t want to meet him?  Check New York hairdresser Kathy Bartlett off your list. She has enough problems with a rotten ex-husband and a car that\'s stranded her. Men and cars. Both overheat at the wrong time. She needs a acation somewhere warm and peaceful, with only subservient males.  Whoever is in charge of wish fulfillment doesn\'t listen well, because Kathy is suddenly flung back to 1542 Scotland. It\'s cold, definitely not peaceful, with nary a subservient male in sight. There\'s only Ian Ross, the Pleasure Master.  Ian\'s brothers demand that he prove his sexual power by seducing a woman no other man can seduce. Who better than Kathy?  She has nothing but contempt for Ian Ross, and as Ian\'s brothers have discovered, any attempt to woo the lass could put a man\'s most precious body parts in grievous danger.  Ian accepts the challenge, confident he can seduce any woman, then leave her with his emotions untouched. Kathy remains determined to resist the explosive attraction she feels for Ian. Love won\'t be denied, but time is an impatient enemy.	''	Romance	''
Ann C. Crouter; Alan Booth	Romance And Sex in Adolescence And Emerging Adulthood: Risks And Opportunities	37.50	18.75	9.38		Lawrence Erlbaum Associates; 1 edition	October 27, 2005	11	1	0		English	080585391X	978-0805853919	paperback	280	Contents: Preface. Part I: What Are the Evolutionary Origins of Contemporary Patterns of Sexual and Romantic Relationships? Where Does Evolution Leave Off and Where Do History and Culture Begin? H.E. Fisher, Broken Hearts: The Nature and Risks of Romantic Rejection. B.L. Barber, To Have Loved and Lost...Adolescent Romantic Relationships and Rejection. D.P. Schmitt, Short- and Long-Term Mating Strategies: Additional Evolutionary Systems Relevant to Adolescent Sexuality. P. Schwartz, What Elicits Romance, Passion, and Attachment, and How Do They Affect Our Lives Throughout the Life Cycle? Part II: How Do Early Family and Peer Relationships Give Rise to the Quality of Romantic Relationships in Adolescence and Young Adulthood? W.A. Collins, M. an Dulmen, \"The Course of True Love(s)...\": Origins and Pathways in the Development of Romantic Relationships. S. Coontz, Romance and Sex in Adolescence and Emerging Adulthood K. Joyner, M. Campa, How Do Adolescent Relationships Influence the Quality of Romantic and Sexual Relationships in Young Adulthood? C.M. Bryant, Pathways Linking Early Experiences and Later Relationship Functioning. B.B.  Brown, A Few \"Course Corrections\" to Collins & an Dulmen\'s \"The Course of True Love\". Part III: How Do Early Romantic and Sexual Relationships Influence People Contemporaneously and Later in Life? P.C. Giordano, W.D. Manning, M.A. Longmore, Adolescent Romantic Relationships: An Emerging Portrait of Their Nature and Developmental Significance. V.M. Murry, T.R. Hurt, S.M. Kogan, Z. Luo, Contextual Processes of Romantic Relationships: Plausible Explanations for Gender and Race Effects. A.R. Snyder, Risky and Casual Sexual Relationships Among Teens. W. Furman, L.S. Hand, The Slippery Nature of Romantic Relationships: Issues in Definition and Differentiation. Part IV: To What Extent Are Current Trends in Sexual and Romantic Relationships Problematic for Individuals, Families, and Society? What Are Effective Intervention Approaches at the Level of Practice, Program, and Policy? J. Manlove, K. Franzetta, S.  Ryan, K. Moore, Adolescent Sexual Relationships, Contraceptive Consistency, and Pregnancy Prevention Approaches. V.J. Hotz, The Economic Approach to Modeling Adolescent Sexual Behavior: Empirical Implications. D.M. Upchurch, Y. Kusunoki, Adolescent Sexual Relationships and Reproductive Health Outcomes: Theoretical and Methodological Challenges. J. Manlove, S. Ryan, K. Franzetta, Sample Selection for Adolescent Sexual Relationships. M.L. Kan, A.C. Cares, From \"Friends With Benefits\" to \"Going Steady\": New Directions in Understanding Romance and Sex in Adolescence and Emerging Adulthood.	Penn State University Family Issues Symposia	Romance	''
Helen Scott Taylor	The Magic Knot	6.99	3.50	1.75		Love Spell	January 27, 2009	3	1	0		English	0505527960	978-0505527967	paperback	308	A contemporary fantasy romance set in the English Westcounty and Ireland. The Magic Knot combines the mystery of Celtic Cornwall with the myths of ancient Ireland in a contemporary setting to give a story full of romance and adventure. You\'ll never think of fairies in the same way again!  Winner of the American Title IV contest run by Romantic Times Magazine in conjunction with Dorchester Publishing.	Love Spell Paranormal Romance	Romance	''
Maria Isabel Pita	Guilty Pleasures - Historical Erotic Romances	16.61	8.30	4.15		Magic Carpet Books, Inc/Magic Carpet Books	June 23, 2005	13	4	0		English	0975533150	978-0975533154	paperback	304	Guilty Pleasures explores the passionate willingness of women throughout the ages to offer themselves up to the forces of love. Historical facts are seamlessly woven into intensely graphic sexual encounters beginning with ancient Egypt and journeying down through the centuries to the present and beyond. Beneath the covers of Guilty Pleasures you\'ll find over twenty erotic love stories with a profound feel for the times and places where they occur. An ancient Egyptian priestess a courtesan rising to fame in Athen\'s Golden Age the lovely sacrifice of a Druid rite a Romanian Count\'s wicked mistress and many more are all one eternal woman in Guilty Pleasures.	''	Romance	''
Lindsay Townsend	A Knight\'s Vow	3.99	2.00	1.00		Zebra Books	March 1, 2008	14	2	4		English	142010361X	978-1420103618	paperback	528	England, 1138. Set against the dangerous backdrop of the crusades, this sweeping romance captures the story of a beautiful, young woman and the dashing knight who will battle his fiercest enemies to win her undying love...	Zebra Debut	Romance	''
Janet Dailey	Western Man and Leftover Love	7.99	4.00	2.00		Pocket	February 24, 2004	13	3	2		English	0743469887	978-0743469883	paperback	368	New York Times bestselling author Janet Dailey portrays the spirit of the American West -- and of men and women with hearts of pride and passion -- in two unforgettable novels.  Western Man Ever since she was a teenager, Sharon Powell has adored Ridge Halliday, a strong, proud Colorado rancher who could set her heart trembling with one glance from his lazy blue eyes. Now, working at his side on a cattle roundup is a dream come true. But Sharon has a bold new dream beyond her girlish fantasies: to win Ridge not just for a night of passion -- but for a lifetime of love.  Leftover Love Layne MacDonald\'s search for her birth mother takes her to a sprawling Nebraska ranch co-owned by the brusque and distant Creed Dawson. As he teaches her to rope and ride, Layne taps into his secret anguish and realizes that she is falling in love. Only a gutsy, determined woman can melt the heart of a man as tough as Creed, and Layne ows that she will be the one.	''	Romance	''
Alison Kent	The Complete Idiot's Guide to Writing Erotic Romance	11.53	5.76	2.88		Alpha	September 5, 2006	10	1	1		English	1592575463	978-1592575466	paperback	336	The basic rules for turning basic instincts into blockbuster success. Erotic romance reigns supreme as a big category of women\'s fiction--a billion dollar business serviced by a new breed of uninhibited writer. This book is the necessary how-to for first timers and a terrific guide for seasoned professionals as well, who are putting their racy--and lucrative--fantasies to paper. Now, for the first time, a eteran erotic romance author shows exactly what to do--and how. - The first book to guide writers to succeed in this multi-million dollar genre - Explores how to set up a plot and write good, steamy sex scenes - From a best-selling experienced author - Includes resource section for research tools and further reading - Interviews with top editors in the field - Foreword by Kate Duffy, editorial director at Kensington Publishing and founding editor of the genre	''	Romance	''
Liz Carlyle	Never Romance a Rake	7.99	4.00	2.00		Pocket; 1st Pocket Books Pbk. Ed edition	July 22, 2008	1	0	0		English	1416527168	978-1416527169	paperback	448	In this sizzling third book in New York Times bestselling author Liz Carlyle\'s compelling historical trilogy, a cynical rake joins a sinister game of cards with dangerously seductive stakes.  If he wins this hand...  Shunning the glittering elite of high society Kieran, Baron Rothewell, prefers the dangerous pursuits of London\'s demimonde. Hardened by a tormented past, he cares little for anyone or anything. So how can he resist the wager proposed by the dissolute Comte de Valigny? A hand of cards for the possession of the comte\'s exquisite daughter.  Will he win her heart?  Abandoned by her highborn father -- until he decides to use her -- Mademoiselle Camille Marchand puts no trust in an aristocrat\'s honor, especially that of the notorious baron. She too is gambling -- for her life -- and Rothwell is just one more card to be used.  But whatever dark desires run through his eins call to her own, and the heart plays its own game -- winner take all!	''	Romance	''
James J. Wilhelm	The Romance of Arthur, New, Expanded Edition: An Anthology of Medieval Texts in Translation	37.75	18.88	9.44		Routledge; New Exp edition	February 1, 1994	5	1	0		English	0815315112	978-0815315117	paperback	592	Here are some of the most important works of medieval Arthurian literature in fresh, new translations that convey the development of King Arthur from Latin chronicles and Celtic mythology into the romantic king of late-medieval literature.	Garland Reference Library of the Humanities, Vol 1267	Romance	''
Jamie Glazov	United in Hate: The Left's Romance with Tyranny and Terror	17.13	12.85	8.56	4.28	WND Books; 1 edition	March 3, 2009	12	0	7	1	English	1935071602	978-1935071600	hardcover	264	United in Hate analyzes the Left\'s contemporary romance with militant Islam as a continuation of the Left\'s love affair with communist totalitarianism in the twentieth century. Just as the Left was drawn to the communist killing machines of Lenin, Stalin, Mao, Pol Pot, and Castro, so too it is now attracted to radical Islam.  Both the radical Left and radical Islam possess a profound hatred for Western culture, for a capitalist economic structure that recognizes individual achievement, and for the Judeo-Christian heritage of the United States. Both seek to establish a new world order: leftists in the form of a classless communist society, and Islamists in the form of a caliphate ruled by sharia law. To achieve these goals, both are willing to wipe the slate clean by means of limitless carnage, with the ultimate goal of erecting their utopia upon the ruins of the system they have destroyed.	''	Romance	''
Sophie Jordan	Sins of a Wicked Duke	6.99	3.50	1.75		Avon	March 31, 2009	10	0	0		English	0061579173	978-0061579172	paperback	384	She works to live . . .  One would think the last place a beauty like Fallon O\'Rourke could keep her irtue was in the Mayfair mansion of London\'s most licentious duke, the notorious Dominic Hale. Yet Fallonwho\'s endured nothing but lecherous advances since her father\'s tragic deathis perfectly safe there . . . disguised as a footman! Beneath the notice of the dark-haired devil with his smoldering blue eyes and sinful smile, Fallon never imagines her secret will be discovered. But how long can her deception last when she begins to wish she is one of the many women traipsing in and out of the sinful rogue\'s bedchamber?  He lives to sin . . .  Most men envy the duke, never suspecting his pleasure-loving ways are a desperate attempt to escape, however briefly, the pain of a past that\'s left him with a heart of stone. Only one woman can break down his defenses. Only one woman can win his love . . . if she reveals her secret and succumbs to the sins of the wicked duke.	Historical Romance	Romance	''
Paige Tyler	Kayla and the Rancher	15.00	7.50	3.75		ABCD Graphics and Design, Inc	August 18, 2008	0	0	0		English	1935152173	978-1935152170	paperback	120	Rancher Cord Holderness needs a wife, but with few prospects in the Wyoming Territory, he decides that the only way to find a well-bred young lady is to get a mail-order bride. However, the girl that\'s supposed to be his mail-order bride gets cold feet and leaves it up to her new friend, Kayla Mathison, to tell him that she\'s changed her mind. But when the handsome rancher assumes that the fiercely independent and stubborn Kayla is his mail-order bride, she finds herself going along with it. Running from an arranged marriage herself, and desperately in need of funds to get herself to San Francisco, she decides to lead Cord on so that she can steal the money she needs from him. But as the days turn into weeks, she finds that the money doesn\'t interest her as much as it once did, especially when Cord starts putting her over his knee and spanking her whenever she becomes a little too willful for his liking. Much to her surprise, she discovers that she\'s fallen in love with him.	''	Romance	''
A.C. Arthur	Defying Desire	5.99	3.00	1.50		Kimani	April 1, 2009	7	3	1		English	0373861095	978-0373861095	paperback	224	Fashion model Tia St. Claire keeps things light when it comes to menno strings, just flings. She\'s got her reasons, thank you. But even she finds Trent Donovan hard to resisthe\'s sexy, successful, persistent and built for a woman\'s wildest dreams. When their one-night stand leaves defiant longings, Tia isn\'t sure whether to run, hide or surrender to the former navy SEAL\'s rugged charms.  The last of the successful and seriously single \"Triple Threat\" Donovan brothers still happily unattached, Trent Donovan has dedicated his career to duty and danger. Until desire and beautiful, spirited Tia change everything. Now he\'s sleepless over an attraction too powerful to deny, and a secret dilemma with only one way outfollowing his heart.	Kimani Romance	Romance	''
Johanna Lindsey	Gentle Rogue	7.99	4.00	2.00		Avon; 1 edition	March 29, 2005	4	2	1		English	0380753022	978-0380753024	paperback	448	Gentle Rouge Heartsick and desperate to return home to America, Georgina Anderson boards the Maiden Anne disguised as a cabin boy--never dreaming she\'ll be forced into intimate servitude at the whim of the ship\'s irrepressible captain, James Mallory.  The black sheep of a proud and tempestuous family, the handsome ex-pirate once swore no woman alive could entice him into matrimony. But on the high seas his resolve will be weakened by an unrestrained passion--and by the high-spirited beauty whose love of freedom and adventure rivals his own.	Malory Novels	Romance	''
Cathy Maxwell	In the Highlander's Bed	6.99	3.50	1.75		Avon	January 29, 2008	3	1	0		English	0061122106	978-0061122101	paperback	384	Highland warrior Gordon Lachlan has spent his life fiercely battling the English. Now, to claim ictory for his clan, he must retrieve the legendary Sword of the MacKenna from the hands of his mortal enemies. His plan: to kidnap Constance Cameron from her remote boarding school and force her wellborn relatives to surrender the sword as her ransom.  But Lachlan is surprised that the woman he\'s snatched from her bed is no malleable miss.  Constance longs for adventure. She\'s tantalized by Lachlan and his passionate cause . . . and tempted enough by his seductive ways to wonder what it would be like to find herself in the Highlander\'s bed . . .	''	Romance	''
Jaimey Grant	Heartless	9.95	4.97	2.49		CreateSpace	September 18, 2008	7	0	2		English	1440414742	978-1440414749	paperback	236	Finding herself abandoned after the death of her father, Leandra Harcourt takes a chance on a dark stranger at a small inn. Married, she learns about her husband during his extended absences, discovering more truth and mystery than she ever could have dreamed. The Duke of Derringer is feared and reviled wherever he goes; he is a man not to be crossed. Finding himself suddenly in need of a wife only interferes with the plans he has already set in motion. Vowing to marry the first woman he meets, he stumbles upon Leandra Harcourt, desperate and alone. With only sporadic isits home, Derringer finds his wife intriguing, baffling, and oddly desirable. In her prosaic attitude and calm demeanor, he discovers a peacefulness that he\'s never known in his life and knows he will never find again. While facing a nameless assassin, his search for his missing cousin intensifies. Little does he realize that in reaching his goal, his enemies may reach theirs, endangering his new bride as well.	''	Romance	''
