Anne Mallory	Three Nights of Sin	5.99	3.00	1.50		Avon	April 29, 2008	11	5	4		English	0061242411	978-0061242410	paperback	384	Three nights of danger . . .  When her brother was arrested for murder, the town shut its doors to Marietta Winters. No one would help her save him from the gallowsno one but Gabriel Noble. In exchange for taking the case, Gabriel requests three favors from the desperate young beauty, and Marietta has no other choice but to make a deal with the sinfully handsome devil.  Three nights of pleasure . . .  Searching for clues in the rough underbelly of London, Marietta must masquerade as a shamelessly wanton wenchmuch to Gabriel\'s delight.  But Marietta swears to herself that her passionate moans are just for show. She could never fall in love with such a maddening, arrogant, seductive stranger . .  . could she?  Three nights of sin . . .  Night after night, she satisfies his wicked cravings. But soon Gabriel wants more from Marietta than just three nights of sin and even a sordid secret in his past won\'t prevent him from trying to possess her forever.	''	Romance	''
Caroline Linden	What A Gentleman Wants	4.99	2.50	1.25		Zebra	September 1, 2006	13	1	4		English	0821779311	978-0821779316	paperback	352	Marcus Reese, Duke of Essex, has spent most of his life pulling his twin brother out of trouble. An occasional thank you would suffice; instead, his resentful sibling forges his name to a marriage license and presents him with an unwanted wife. She\'s a icar\'s window with a mind of her own who may be the first person in Marcus\'s well-ordered life to make him feel...completely out of control. Hannah can\'t help but curse her own idiocy. Dire straits have led her to the altar with a gentleman she hardly knows. Played for a fool, she\'s embarrassed, furious, and worse, married to an equally outraged stranger - an exasperating man who unleashes all manner of emotions in Hannah, not to mention unwanted desire. Reluctantly, she agrees to play the wife until he can sort out the mess. But the nearness of the undeniably attractive Duke and the passion in his black eyes unsettles her well-guarded heart - making her want to do so much more than \"act\" the role of blissful bride...	Zebra Historical Romance	Romance	''
Christie Kelley	Every Night I\'m Yours	3.99	2.00	1.00		Zebra	February 1, 2008	11	2	6		English	1420103512	978-1420103519	paperback	384	At twenty-six, aspiring novelist Avis Copley intends to wear spinsterhood as a badge of honour. But when she discovers a olume of erotica that ignites a searing fire within her, Avis realizes just how much she doesn\'t know about the actual pleasures of the flesh. Determined to learn more, she devises a daring plan...Avis chooses Emory Billingsworth, a fellow novelist - not to mention a beautiful specimen of manhood - to instruct her in carnal pleasure. But when the brash earl of Selby, Banning Talbot, a man she has known for years, unearths Avis\' true intentions, he claims she\'s made a dangerously bad choice. Volunteering his services for one wicked night of reckless, abandoned passion, Banning promises he will satisfy all of her deepest longings.  Yet, Banning cannot begin to imagine the effect his wilful, oluptuous, and ery eager student will have on him - or how far an innocent lesson in desire can go.	Zebra Historical Romance	Romance	''
Jessica Trapp	Master Of Pleasure	5.99	3.00	1.50		Zebra	June 7, 2005	5	1	1		English	0821778617	978-0821778616	paperback	352	He haunted her dreams. She haunted his nightmares.  She betrayed him at the altar and her father sold him into slavery.  Kidnapping her was only the beginning of his revenge.	Zebra Historical Romance	Romance	''
Sophie Jordan	Too Wicked to Tame	6.99	3.50	1.75		Avon; Reprint edition	February 27, 2007	1	0	0		English	0061122262	978-0061122262	paperback	384	Would a Reluctant Beauty Ever Wed . . .  Headstrong Lady Portia Derring has an impeccable pedigree . . . and not a penny to her name. Which is why she is alone on the rain-swept Yorkshire moor, waiting for a wealthy earl she has never met but whom her family insists she wed. When she\'s nearly trampled by the blackguard\'s stallion, Portia is more determined than ever to refuse Heath Moreton\'s suit. Handsome devil he may be, but she could never marry a rogue who\'s so clearly out of control!  A Wild, Incorrigible Beast?  An avowed bachelor, scion of the notorious \"Mad\" Moreton clan, Heath won\'t be shackled in matrimony. Why then does this rain-drenched beauty excite him so? Desire consumes him, but the eminently beddable lady resists his well-practiced seductions. Now only one route remains: Heath must ignore his bad blood, anquish his inner beast . . . and prove to Portia that she\'s the only woman capable of taming his heart.	'' 	Romance	''
Victoria Dahl	To Tempt A Scotsman	3.99	2.00	1.00		Zebra	August 1, 2007	12	2	0		English	1420100157	978-1420100150	paperback	352	After finding herself at the centre of a ery public scandal that left one man dead and another on the run, Lady Alexandra Huntington has exiled herself to her brother\'s estate and is content to manage his affairs. But the arrival of darkly handsome Collin Blackburn awakens her curiosity and her desire - and the advantage of being a fallen woman is that she can be ruined only once...After a promise sworn to his father, Collin Blackburn is compelled to seek the aid of the woman who brought about his brother\'s death in a senseless duel. Yet Lady Alexandra is not the shameless femme fatale he expected. In fact, Collin suspects she is guilty of nothing more than a hunger to experience passion, and the brawny Scot is certainly equipped to oblige. But the quick-witted, keenly sensual Alexandra has a few lessons of her own to impart - on life, love, and the delicious joys of succumbing to temptation...	Zebra Debut 	Romance	''
Hannah Howell	Highland Bride	4.99	2.50	1.25		Zebra	August 1, 2006	9	1	2		English	0821779958	978-0821779958	paperback	352	Though she has yet to be courted by any man, spirited Gillyanne Murray decides the time has come to isit the dower lands gifted to her by her father\'s kinsmen. She arrives to find the small keep surrounded by three lairds, each one ying for her hand...and property. Though resolved to refuse them all, the threat of battle on her threshold forces her to boldly choose a suitor: Sir Connor MacEnroy, a handsome, daring knight of few words. As his wife, Gillyanne is stunned by his terse, cold distance - and her own yearning to feel passion in his arms. Now, bringing her healing touch to a land and a keep ravaged by treachery and secret enemies, she dares to reach out for the one thing she fears she may forever be denied...her husband\'s closely guarded heart.	Zebra Historical Romance	Romance	''
Melissa Mayhue	Thirty Nights with a Highland Husband	6.99	3.50	1.75		Pocket	June 26, 2007	2	0	0		English	1416532862	978-1416532866	paperback	384	SCOTLAND, 1272. Connor MacKiernan, a descendant of the Fae Prince, is a warrior who lives only for honor and duty. Though he\'s owed never to marry, that\'s exactly what he must do to save his sister. Enter a little Faerie magic, and the search for a bride is on.  DENVER, 2007. Caitlyn Coryell is having a really bad day -- she just discovered her fianc with another woman! Imagine her surprise when she puts on some sexy lingerie and an antique pendant and Connor appears in her bedroom, begging for her help. He offers a simple yet outrageous adventure: travel to his time, marry him, and return home.  But nothing\'s simple when Cate is trapped in the thirteenth century. The wedding\'s delayed, someone\'s trying to kill her, and in the middle of all this, she realizes she\'s falling in love with a man who can only be her husband for thirty nights.	The Daughters of the Glen, Book 1	Romance	''
Sophie Jordan	One Night with You	5.99	3.00	1.50		Avon	December 26, 2007	3	0	2		English	0061339261	978-0061339264	paperback	368	Anything can happen after dark . . .  Tired of being treated like a servant by her own family, Lady Jane Guthrie finally has a chance to escape .  . . at least for one night. Attired in a daring gown, she arrives at a scandalous courtesans\' masquerade ball looking forward to her few hours of freedom. But when she sees Seth Rutledge, her skin begins to tingle with anticipation. Many years ago, Seth broke her heart by falling for her beautiful, title-hungry sister. But now here he is, right in front of her, offering her his lips . . .  Embittered by war, Seth returns home to inherit the title that would have once won him the woman of his dreams. Though duty demands he wed, he\'s convinced passion no longer has a place in his life . . . until a masked siren sets his heart aflame. Desperate to find her again, he has no idea it\'s his childhood friend Janeand that after one night together their lives will never be the same.	''	Romance	''
Elizabeth Amber	Nicholas: The Lords of Satyr	10.15	5.08	2.54		Aphrodisia	August 1, 2007	7	1	3		English	0758220391	978-0758220394	paperback	256	In the heart of Tuscany\'s centuries-old wine country, three half-Satyr brothers receive a letter that sends them in search of three endangered half-Faerie brides. The daughters of a dying king, they present a unique opportunity for the wealthy, charismatic Lords of Satyr to beget heirs to inherit their Italian ineyard and ancient secrets.......... For not just any woman will do as a Satyr wife. Each month at Moonful, the brothers change physically, becoming more powerfully potent. They\'re driven by the darker side of their natures to indulge in a nightlong ritual in a sacred gathering place ringed with statues of Bacchus, nymphs, dryads, and fauns........... Eldest brother Nick considers it his duty to sire heirs. But he prefers to keep his conjugal isits to Jane, his new FaerieBlend wife, proper while engaging in more carnal activities with experienced courtesans........... Unaware that she\'s half-Faerie, Jane is desperate to rid herself of the terrible abilities she acquired when she turned thirteen. Only then will she bear Nick\'s children and find a true home with him. Until then, she must deceive him........... As the grapevines begin to bloom, an ancient cult hatches plans that could destroy Nick and Jane\'s blossoming happiness.	''	Romance	''
Trisha Telep (Editor)	The Mammoth Book of Vampire Romance	12.56	6.28	3.14		Running Press	July 2008	0	0	0		English	0762434988	978-0762434985	paperback	512	The biggest names in paranormal romance have created a fascinating array of 30 short stories of hot blood and inhuman passions that will leave you thirsting for more. Authors include Sherri Erwin, Caitlin R. Kiernan, Jenna Black, Jenna Maclaine, Raven Hart, Delilah Devlin, Keri Arthur, Kimberly Raye, Alexis Morgan, Lilith Saintcrow, C.T. Adams, Cathy Clamp, Susan Sizemore, Dina James, Colleen Gleason, Barbara Emrys, Savannah Russe, Shiloh Walker, Vicki Pettersson, Rebecca York, Rachel Vincent, Amanda Ashley, Karen Chance, and Nancy Holder. These aint your mothers ampires!	Mammoth Books	Romance	''
Jaci Burton	Wild, Wicked, & Wanton	9.75	4.88	2.44		Berkley Trade; Heat edition	May 1, 2007	14	5	2		English	0425213838	978-0425213834	paperback	336	Three friends reveal their most intimate secrets in an erotic romance from \"an undoubted master.\"* They\'re inseparable friends who share their wildest secrets and dares. The latest bet is the boldest of all: each must sleep with whomever the others have chosen and return with every juicy detail. For divorce Abby it\'s a pair of sexy eterinarians who are fulfilling their own desire. For heartbreaker Blaire it\'s the one man she never had the courage to bed. For sensible Callie it\'s an irresistible stranger. For readers, it\'s an erotic fantasy come true.	Berkley Heat	Romance	''
Joan Johnston	The Barefoot Bride	7.99	4.00	2.00		Dell	December 2, 1991	3	0	1		English	0440211298	978-0440211297	paperback	400	Young widowed Molly decides to leave the security of Boston and travel to the wilds of Montana as a mail-order bride. After all, she has two children to consider. She\'ll marry first, and reveal her family later. But Molly isn\'t prepared for a dashing doctor, who has a heart of gold and kisses to match. Original.	''	Romance	''
Elizabeth Hoyt	The Raven Prince	6.99	3.50	1.75		Forever; Reissue edition	November 1, 2006	5	1	0		English	0446618470	978-0446618472	paperback	392	There comes a time in a woman?s life when she must do the unthinkable - and find employment. For the widowed Anna Wren, that means taking a job as female secretary for the Earl of Swartingham. Secretaries are always male - never female - as Anna well knows but the real downfall of her career is the realisation that she is falling in love with Edward de Raaf - the Earl. But when she realises that he is going to isit a brothel in London to take care of his \'manly\' desires, Anna sees red - and decides to take advantage of the opportunity to also take care of her \'womanly\' desires - with the Earl as her unknowing lover. But the Earl has another reason for going to London. He is formalising his betrothal and trying (with little success) to forget about a secretary that has no right being female. Unhandsome, he knows that no woman wants him. Except for the mysterious lady with whom he spent two unforgettable nights at Aphrodite?s Grotto, the most scandalous brothel in London. But when Anna?s plan is revealed, a bit of blackmail is thrown into the mix, a proposal is rejected and even the Earl himself will be unprepared for the intrigues that ensnare them.	''	Romance	''
Lorraine Heath	In Bed With the Devil	6.99	3.50	1.75		Avon	June 24, 2008	2	0	0		English	0061355577	978-0061355578	paperback	384	They call him the Devil Earla scoundrel and accused murderer who grew up on the iolent London streets. A proper young lady risks more than her reputation when consorting with the roguishly handsome Lucian Langdon, but Lady Catherine Mabry believes she has no choice. To protect those she loves, she would do anythingeven strike a bargain with the devil himself.  Lucian desires respectability and a wife above all else, but the woman of his choosing lacks the social graces to be accepted by the aristocracy. Catherine can help Lucian gain everything he wants. But what she asks for in exchange will put their ery lives in jeopardy. When danger closes in, Catherine discovers a man of immense passion and he discovers a woman of immeasurable courage. As secrets from his dark past are revealed, Lucian begins to question everything he knows to be true, including the yearnings of his own heart.	Avon Romantic Treasure	Romance	''
Alexandra Ivy	When Darkness Comes	6.99	3.50	1.75		Zebra	January 1, 2007	9	0	0		English	0821779354	978-0821779354	paperback	384	It\'s been a hell of a day for Abby Barlow. In just a few hours, she\'s survived an explosion, watched her employer die, had a startling dream, and now she finds herself in a seedy Chicago hotel with the sexy, unearthly Dante, a man she both desires and fears. For 341 years, Dante has stood as guardian to The Chalice, a mortal woman chosen to hold back the darkness. A terrible twist of fate has now made Abby that woman. Three hours ago, Dante would have used all his charms to seduce her. Now she is his to protect. And he will do so until his ery death. A terrifying plan has been set in motion, one that will plunge Dante and Abby into an epic battle between good and evil - and a desperate race to save their love...	Guardians of Eternity, Book 1	Romance	''
Deborah MacGillivray	A Restless Knight	3.99	2.00	1.00		Zebra	July 1, 2006	1	0	0		English	0821780360	978-0821780367	paperback	352	~ A Defiant Lady ~ In Scotland\'s darkest hour, an English warrior dressed all in black has come for her. Blessed with the kenning, Lady Tamlyn MacShane foresaw this day, when the ruthless Lord Julian Challon would conquer her land -- and her heart. She is determined to resist him...but she is no match for his strength...or his sensuality...  ~ A Resolute Lord ~ To Julian, the proud Scotswoman should be nothing more than a captive. Yet Tamlyn\'s fiery Beauty ensnares him, body and soul. Now, the warrior known as the Black Dragon is in danger of falling under the spell that cannot be broken---the spell of love....	The Dragons of Challon, Book 1 	Romance	''
Dawn Mactavish	The Privateer	6.99	3.50	1.75		Leisure Books	January 2008	8	0	2		English	0843959819	978-0843959819	paperback	325	THE PRIVATEER Lark at first hoped it was a simple nightmare: If she closed her eyes, she would be back in the mahogany bed of her spacious boudoir at Eddington Hall, and all would be well. Her father, the earl of Roxburgh, would not be dead by his own hand, and she would not be in Marshalsea debtor\'s prison.  Such was not to be. Ere the Marshalsea could do its worst, the earl of Grayshire intervened. Lark shivered, considering the mysterious stone-faced noble. He\'d paid her bond while the rest of London turned an eye as blind as the one beneath his eye patch. But while his touch was electric and his gaze piercing, for what purpose had he bought her freedom? A plan including Cornwall, return to the world of the haute ton, and embroilment in a struggle against both England\'s own Admiralty and the French. But even more perilous, the ex-sea captain might plunder her heart. No, this was not a dream. As Lark would soon learn, her dreams had never ended so well.	Leisure Historical Romance	Romance	''
Sandy Lynn	Kiss and Tell	9.60	4.80	2.40		Samhain Publishing	January 1, 2008	5	0	3		English	1599986299	978-1599986296	paperback	224	Boxers or briefs? Willow is having a bad day. To get her sister to stop harassing her, she agrees to play a silly game-but only once. When a muscular hunk walks past her, Willow\'s mouth waters and she knows she\'s found the perfect man to ask her embarrassing question. Seth is shocked when a beautiful woman sits on his lap. He\'s amused when she begins asking him questions. But he\'s aroused when she kisses him. Taking her back to his home, he sinks his teeth into her-and is addicted. Imagine his surprise when he finds out she holds his life in the palm of her hands. What\'s a ampire to do when the woman he needs for his survival runs screaming from him? Warning, this title contains the following: explicit sex and graphic language.	Bloodmates, Book 1	Romance	''
Lisa Kleypas	Mine Till Midnight	7.99	4.00	2.00		St. Martin\'s Paperbacks	October 2, 2007	14	3	1		English	0312949804	978-0312949808	paperback	384	When an unexpected inheritance elevates her family to the ranks of the aristocracy, Amelia Hathaway discovers that tending to her younger sisters and wayward brother was easy compared to navigating the intricacies of the ton.  Even more challenging: the attraction she feels for the tall, dark, and dangerously handsome Cam Rohan.Wealthy beyond most mens dreams, Cam has tired of societys petty restrictions and longs to return to his uncivilized Gypsy roots.  When the delectable Amelia appeals to him for help, he intends to offer only friendshipbut intentions are no match for the desire that blindsides them both.  But can a man who spurns tradition be tempted into that most time-honored arrangement: marriage? Life in London society is about to get a whole lot hotter.	The Hathaways, Book 1	Romance	''
Laura Lee Guhrke	And Then He Kissed Her	6.99	3.50	1.75		Avon	February 27, 2007	15	1	0		English	006114360X	978-0061143601	paperback	384	An expert in etiquette, Emma takes her pristine reputation most seriously.  But the devilish Lord Marlowe is determined to prove that some rules of proper behavior are made to be broken . . .	''	Romance	''
Lora Leigh	Wicked Pleasure	10.94	5.47	2.73		St. Martin\'s Griffin; 1st edition	May 13, 2008	12	0	4		English	0312368720	978-0312368722	paperback	368	From New York Times bestselling author Lora Leigh comes the explosivenew novel in her Bound Hearts series.Jaci Wright has been running from the Falladay twins, Chase and Cam, for seven years now. Fears of the desires they arouse in her, and the knowledge of the relationship they wanted with her, spurred her to run, to find a life that kept her traveling the globe and out of their reach.But now life has come full circle. A new job has placed Jaci in the Sinclair mansion with Chase and Cam. And they\'re tired of waiting. It\'s hard enough to face accepting a relationship with two men rather than just one, but gossip and the tattered tales of juicy secrets fill the society she now moves within. Can Jaciface the world knowing she\'s a lover to both men, or will her hesitancy and her fears destroy her chance of happiness forver?	Bound Hearts	Romance	''
Lora Leigh	Forbidden Pleasure	10.94	5.47	2.73		St. Martin\'s Griffin; 1st edition	June 12, 2007	10	0	0		English	0312368712	978-0312368715	paperback	352	People have heard of fleeting rumors about The Club. Located just outside Washington, D.C., only its members know where men go when they want to indulge the desire to share their women with a carefully selected male partner.John Mac McCoy resigned his membership from The Club when he married Keiley Hardin. Tempting and innocent, sweet and sexy, she would never accept Macs desire to share her with another man. However, Macs fantasies of sharing his wife haunt his dreams. And his passions. Unable to wait any longer to draw his best friend Jethro Riggs into his marriage, Mac invites Jethro to their home with the intention of drawing Keiley into the pleasures that only be achieved when two men love the same woman. But theres more going on in Macs neck of the woods than a little additional pleasure. A past case, a stalker that likes to playing games and his wife is now in the middle of it all. Passion and pleasure, danger and desire combine as forbidden pleasure becomes an addiction none of them can escape.	Bound Hearts, Book 8	Romance	''
Lisa Kleypas	Seduce Me at Sunrise	7.99	4.00	2.00		St. Martin\'s Paperbacks	September 30, 2008	1	0	0		English	0312949812	978-0312949815	paperback	384	Ke Merripen has longed for the beautiful, well-bred Winnifred Hathaway ever since her family rescued him from the brink of death when he was just a boy. But this handsome Gypsy is a man of mysterious originsand he fears that the darkness of his past could crush delicate, luminous Win. So Ke refuses to submit to temptationand before long Win is torn from him by a devastating twist of fate.  Then, Win returns to Englandonly to find that Ke has hardened into a man who will deny love at all costs. Meantime, an attractive, seductive suitor has set his sights on Win. Its now or never for Ke to make his move. But first, he must confront a dangerous secret about his destinyor risk losing the only woman he has lived for	The Hathaways, Book 2	Romance	''
Megan Hart	Tempted	10.94	5.47	2.73		Spice	January 1, 2008	4	1	0		English	0373605196	978-0373605194	paperback	432	I had everything a woman could want My husband, James. The house on the lake.  My life. Our perfect life.  And then Alex came to isit.  The first time I saw my husband\'s best friend, I didn\'t like him. Didn\'t like how James changed when he was around, didn\'t like how his penetrating eyes followed me everywhere.  But that didn\'t stop me from wanting him. And, surprisingly, James didn\'t seem to mind.  It was meant to be fun. Something the three of us shared for those hot summer weeks Alex stayed with us. Nobody was supposed to fall in or out of love. I didn\'t need another man, not even one who oozed sex like honey and knew all the secrets I didn\'t know, the secrets my husband hadn\'t shared.  After all, we had a perfect life.  And I loved my husband.  But I wasn\'t the only one.	''	Romance	''
Nora Roberts	The Pagan Stone: The Sign of Seven Trilogy	7.99	4.00	2.00		Jove	November 25, 2008	7	4	0		English	0515144665	978-0515144666	paperback	336	From the #1 New York Times bestselling author of Blood Brothers and The Hollow--the conclusion to the electrifying trilogy of three men and three women who join forces--and hearts--to battle the ultimate evil.	''	Romance	''
Kimberly Zant	Surrender	7.91	3.96	1.98		New Concepts Publishing	March 26, 2007	8	1	6		English	1586088998	978-1586088996	paperback	172	Desperate straights call for desperate measures---If anyone had asked Anna before what she would be willing to do for money, what she\'d just signed up for would NOT have been on the list. She\'s discovered, though, that the needy can\'t afford to be too picky. And, after all, what\'s six weeks in the scheme of things? Despite her internal pep talk, though, she discovers she isn\'t at all prepared for what she has to face in the mansion of ill repute-where \'no\' is no longer a part of her ocabulary unless she wants to forfeit the money she needs so badly. Rating: Contains explicit sex, graphic language, and some scenes of sex with mulitple partners/mnage a trois.	''	Romance	''
Nicholas Sparks	The Lucky One	16.49	12.37	8.24	4.12	Grand Central Publishing; First Edition edition	September 30, 2008	6	1	0	0	English	0446579939	978-0446579933	hardcover	336	In his 14th book, bestselling author Nicholas Sparks tells the unforgettable story of a man whose brushes with death lead him to the love of his life. Is there really such thing as a lucky charm? The hero of Nicholas Sparks\'s new novel believes he\'s found one in the form of a photograph of a smiling woman he\'s never met, but who he comes to believe holds the key to his destiny. The chain of events that leads to him possessing the photograph and finding the woman pictured in it is the stuff of love stories only a master such as Sparks can write.	''	Romance	''
