Kate Walker	Kate Walker\'s 12 Point Guide to Writing Romance	24.75	12.38	6.19		Studymates Ltd; 2nd edition	July 30, 2008	4	0	0		English	1842851314	978-1842851319	paperback	265	If you want to write romance and be a professional writer then this book is a must for you. Following on from the success of the first edition of this book, which won a major award, this guide explains what is meant by romance and takes you through the process of writing emotion and conflict. The author explains how dialogue should be natural between your heroine and her hero and she explains the difference between sensuality and passion. With an expanded text and more true insider-secrets this is a must for all writers of romance, whether professional or amateur.In this book you will learn: how to write emotion and create PTQ (page turning quality); why dialogue is the lifeblood of your novel; and, the importance of \'after\' and why the intense black moment in romance is so important. The book will appeal to: all students taking courses to improve their creative writing skills; post 16-Level students and first-year undergraduates on creative writing and creative studies degrees; adult education centres including WEA; teachers, tutors and lecturers; school libraries, reference and public libraries; and, University and college central libraries.  It is ideal for undergraduates. The related titles in the series include: \"Writing TV Scripts\"; \"Writing Historical Fiction\"; \"Starting to Write\" and \"Writing Crime\".	Studymates Writers Guides	Romance	''
Carol Ann Didier	Apache Warrior	3.99	2.00	1.00		Zebra	April 1, 2008	7	0	3		English	1420103768	978-1420103762	paperback	352	\"Unbidden Yearnings Always Lead To\"...Every day that Amanda Carroll and her sister travel farther west, they worry about possible Indian attacks. Their greatest fear becomes reality when five armed Apaches surround their coach. Brazenly confronting her attackers, Amanda looks straight into the dark eyes of their fierce leader - only to be shocked by the intense attraction she feels for this bronzed Apache warrior...\"The Most Wicked Pleasure\"...Kayto and his warriors had no intention to harm anyone, let alone the stunning woman before him. He is intrigued by her courage as she stares at him so defiantly - and a slow, searing desire ignites deep within him. Now he will not rest until the woman he dreams of day and night is his own...	Zebra Historical Romance	Romance	''
Joey W. Hill	The Vampire Queen\'s Servant	10.98	5.49	2.75		Berkley Trade	July 3, 2007	7	1	0		English	0425215903	978-0425215906	paperback	384	Paranormal erotica from an award-winning author who stands out in a genre known for its out-of-the-ordinary love play.\" (Romance Studio) Lady Elyssa Yamato Amaterasu Wentworth is a centuries-old ampire who\'s been given a new servant-Jacob, a total alpha male unaccustomed to submitting to any woman\'s wishes. What really binds Jacob to her are not her sensual midnight hungers, but something far more provocative. It stirs her blood, renews her life, and awakens her soul like only true love can. The passion between Elyssa and Jacob yields something else unexpected-a shared history that reaches back through the centuries and is fated to challenge their destiny like nothing ever will again.	Vampire Queen, Book 1	Romance	''
Kerrelyn Sparks	Secret Life of a Vampire	7.99	4.00	2.00		Avon	March 31, 2009	4	2	0		English	0061667854	978-0061667855	paperback	384	Nothing\'s sexier than an man who can keep a secret.  A typical bachelor party is all about beers and beautiful women. A ampire bachelor party is no different -- except the men are drinking Blissky (whiskey-flavored synthetic blood). And no one can throw a party quite like Jack, the illegitimate son of the legendary Casanova. But when the party gets out of hand and the cops show up, Jack has some explaining to do . . . if only he wasn\'t struck speechless by the beauty of Officer Lara Boucher.  Lara is sure there\'s something more than a bachelor party going on. What is Jack hiding? And why is he so interested in the recent disappearance of young women all over town? Her investigation uncovers more than she wants to know, especially about this modern-day Casanova. But if she\'s ever to make detective, she\'ll need to expose all his secrets . . . if only her heart wasn\'t on the line.	Love at Stake, Book 6	Romance	''
Dennis Rainey , Barbara Rainey , Bob DeMoss	Rekindling the Romance: Loving the Love of Your Life	13.49	6.75	3.37		Thomas Nelson	January 10, 2006	14	1	1		English	0785285563	978-0785285564	paperback	304	By God\'s design, romance is supposed to be the flame in the fireplace of marital intimacy. Yet far too many Christian couples feel cheated because their marriage produces as much spark as a book of wet matches. Others have neglected to fan the flames of passion for so long that they have lost hope of experiencing romance.  Rekindling the Romance, now available in trade paper, is organized into short, biblically-based chapters. Packed with practical insight, this tastefully candid and inviting resource provides the Christian couple with the keys to unlock their relational and sexual intimacy.	''	Romance	''
Elissa Wilds	Between Light and Dark	6.99	3.50	1.75		Love Spell	October 28, 2008	12	10	0		English	050552791X	978-0505527912	paperback	308	The strongest force on Earth can\'t be controlled. Not even by a powerful god or a talented witch!	Paranormal Romance	Romance	''
Gena Showalter	The Darkest Kiss	6.99	3.50	1.75		HQN Books	June 1, 2008	8	1	0		English	0373772327	978-0373772322	paperback	384	She has tempted many men but never found her equal.  Until now.  Though she has lived for centuries, Anya, goddess of anarchy, has never known pleasure. Until Lucien, the incarnation of deatha warrior eternally doomed to take souls to the hereafter. He draws her like no other. And Anya will risk anything to have him.  But when the merciless Lord of the Underworld is ordered by the gods to claim Anya herself, their uncontrollable attraction becomes an anguished pursuit. Now they must defeat the unconquerable forces that control them, before their thirst for one another demands a sacrifice of love beyond imagining.	Lords of the Underworld, Book 2	Romance	''
Tracy Madison	A Taste of Magic	6.99	3.50	1.75		Love Spell Paranormal Romance	February 24, 2009	5	2	0		English	050552810X	978-0505528100	paperback	292	A young, divorced bakery owner discovers she\'s inherited her gypsy ancestress\'s fabulous magical powers, but learns that when seeking true love with a hunky new neighbor, a person has to be careful what she cooks up.	''	Romance	''
Nia, K. Foxx	The Rancher's Ultimatum	9.90	4.95	2.48		Phaze Books	August 1, 2007	9	2	1		English	159426743X	978-1594267437	paperback	136	Years after leaving her step-family\'s ranch to pursue a new life and career, Lynn James is called back to save the property from the crafty yet handsome Jake Ragnall. The feud between the families has yet to die, and Lynn is trapped in the middle, torn between her loyalty to the men who raised her and the man who ignites her desire. Jake Ragnall has loved Lynn for years, and uses the opportunity to win her heart. To win her family\'s ranch, she must spend the week with him. Will his plans to dominate her help to win her love, or push her away for good?	''	Romance	''
Evangeline Anderson	Secret Thirst	14.99	7.50	3.75		Ellora\'s Cave Publishing Inc.	July 25, 2008	15	3	3		English	141995279X	978-1419952791	paperback	268	Secret Thirst By Evangeline Anderson Dr. Lauren Wright is a serious research scientist with blonde hair, smoky green eyes and a curvy plus-size figure. Too bad her closest relationship is with her laptop, where she stores all her most forbidden fantasies of erotic submission. Lauren has perfected the formula for NuBlood, an artificial blood substitute that is identical to donor blood. Nicolas Kris works for a ampire organization that needs the formula for NuBlood in order to \"come out\" to the world at large and prove that ampires are more than the blood-sucking fiends found in horror movies. He swipes Lauren\'s Mac, thinking that the formula is encrypted inside.  What he finds instead is a code worth breaking--the key to Lauren\'s heart. When they meet, it\'s hate at first sight. But a sinister group of amps who don\'t want to be outed attack Lauren, forcing her and Kris to take refuge at the most notorious bondage/Domination night club in Houston, where the price of admission is fantasy and desire. In order to survive, Lauren will have to act out her own erotic scenarios with Kris acting as her Master while he does his best to quench her Secret Thirst.	''	Romance	''
Mariah Stewart	Dark Truth: A Novel	6.99	3.50	1.75		Ballantine Books	October 25, 2005	8	3	1		English	0345476697	978-0345476692	paperback	336	WILL THE TRUTH SET HER FREEOR SET A TRAP?	''	Romance	''
Elaine Overton	Sugar Rush	5.99	3.00	1.50		Kimani	April 1, 2009	10	0	1		English	0373861117	978-0373861118	paperback	224	For bakery owner Sophie Mayfield, life is getting sweeter by the minute. She\'s managed to keep her family\'s cherished business from being acquired by mega-grocery-chain Fulton Foods. And her new employee Eliot Wright is as appealingand oh-so-chocolate-fineas he is hardworking and talented.  But then Sophie discovers that Eliot isn\'t exactly who he says he is. And she\'s sure he\'s hungry for only one thing: her boutique bakery\'s bottom line. Now a love-struck Eliot will have to do whatever it takes to win back Sophie\'s trustand prove that he truly is her Mr. Right.	Kimani Romance	Romance	''
Russell Roberts	The Invisible Heart: An Economic Romance	14.93	7.46	3.73		The MIT Press	March 7, 2002	11	1	0		English	0262681358	978-0262681353	paperback	282	A love story that embraces the business and economic issues of the day? The Invisible Heart takes a provocative look at business, economics, and regulation through the eyes of Sam Gordon and Laura Silver, teachers at the exclusive Edwards School in Washington, D.C. Sam lives and breathes capitalism.  He thinks that most government regulation is unnecessary or even harmful. He believes that success in business is a irtue. He believes that our humanity flourishes under economic freedom. Laura prefers Wordsworth to the Wall Street Journal. Where Sam sees ictors, she sees ictims. She wants the government to protect consumers and workers from the excesses of Sam\'s beloved marketplace.  While Sam and Laura argue about how to make the world a better place, a parallel story unfolds across town. Erica Baldwin, the crusading head of a government watchdog agency, tries to bring Charles Krauss, a ruthless CEO, to justice. How are these two dramas connected? Why is Sam under threat of dismissal? Will Erica Baldwin find the evidence she needs? Can Laura love a man with an Adam Smith poster on his wall? The answers in The Invisible Heart give the reader a richer appreciation for how business and the marketplace transform our lives.	''	Romance	''
Francine Saint Marie	Girl Trouble	9.21	4.61	2.30		CreateSpace	April 1, 2008	13	8	4		English	1438202105	978-143820210	paperback	104	[Was: $11.99 - Amazon Price: $9.21]...................FIRST-TIMERS, TWO-TIMERS AND SECOND CHANCES: Joan Majors is, in her own words, a faithless, bragging womanizer. But when she meets sexy first-timer and new divorcee, Annette Martineau, she falls head over high-heels in love with her and ows to mend those wicked ways. That\'s good news to Annette because if there\'s one thing in the world she really can\'t stand, it\'s a faithless, bragging womanizer. Especially one itching to get her in bed.  GIRL TROUBLE tells the love story and rocky romance of Joan and Annette in five short tales and includes the popular Amazon-Shorts, \"Dear Joan\" and \"Another Dear Joan\". (Note From the Publisher: Francine Saint Marie\'s debut novel THE SECRET KEEPING was a LAMBDA Notable Book, a finalist for the Goldie Award in fiction, a semi-finalist for the Independent Publishers Award, and an IPPY Bronze medalist.)	''	Romance	''
Kendra Leigh Castle	Call of the Highland Moon	6.99	3.50	1.75		Casablanca Pr	May 1, 2008	5	3	0		English	1402211589	978-1402211584	paperback	384	\"Castle is a rising star! Call Of The Highland Moon thrills with seductive romance and breathtaking suspense. This is an author to watch!\"	''	Romance	''
Cheryl Brooks	Slave	6.99	3.50	1.75		Sourcebooks Casablanca	April 1, 2008	4	2	0		English	1402211929	978-1402211928	paperback	320	\"Hot, dangerous, and sexy.\"	The Cat Star Chronicles	Romance	''
Julie Ortolon	Almost Perfect	6.99	3.50	1.75		Signet	September 6, 2005	8	2	0		English	0451216407	978-0451216403	paperback	304	Maddy, Christine, and Amy find that an old college roommate has written about them in her new self-help book-and they\'re furious that she\'s used them as examples of how women screw up their lives. And the worst part is, it\'s sort of true. Together they make a pact: they\'ll face down their fears-and maybe show Miss Perfect a thing or two!	Perfect Trilogy, Book 1	Romance	''
G.A. Aiken	About A Dragon	6.99	3.50	1.75		Zebra; Reprint edition	December 1, 2008	5	0	0		English	1420103741	978-1420103748	paperback	352	For Nolwenn witch Talaith, a bad day begins with being dragged from bed by an angry mob intent on her crispy end and culminates in rescue by - wait for it - a silver maned dragon. Existence as a hated outcast is nothing new for a woman with such powerful secrets. The dragon, though? A tad unusual. This one has a human form to die for, and knows it.According to dragon law, Talaith is now his property, for pleasure...Or otherwise. But if Lord Arrogance thinks she\'s the kind of damsel to acquiesce without a word, he\'s in for a surprise...Is the woman never silent? Briec the Mighty knew the moment he laid eyes on Talaith that she would be his, but he\'d counted on tongue-lashings of an altogether different sort. It\'s embarrassing, really, that it isn\'t this outspoken female\'s magicks that have the realm\'s greatest dragon in her thrall.  No, Briec has been spellbound by something altogether different - and if he doesn\'t tread carefully, what he doesn\'t know about human women could well be the undoing of his entire race...	Dragon Kin, Book 2	Romance	''
Kresley Cole	No Rest for the Wicked	7.99	4.00	2.00		Pocket Star; 1 edition	October 31, 2006	11	0	6		English	1416509887	978-1416509882	paperback	384	In this next installment in the Immortals After Dark Series, USA Today Bestselling author Kresley Cole delivers a scorching tale about a forbidding ampire who lives in the shadows and the beautiful assassin who hunts him there.A soldier weary of life . . .Centuries ago, Sebastian Wroth was turned into a ampire -- a nightmare in his mind -- against his will. Burdened with hatred and alone for ages, he sees little reason to live. Until an exquisite, fey creature comes to kill him, inadvertently saving him instead.A Valkyrie assassin dispatched to destroy him . . .When Kaderin the Cold Hearted lost her two beloved sisters to a ampire attack long ago, a benevolent force deadened her sorrow -- accidentally extinguishing all of her emotions. Yet whenever she encounters Sebastian, her feelings -- particularly lust -- emerge multiplied.  For the first time, she\'s unable to complete a kill.Become competitors in a legendary hunt.The prize of the month-long contest is powerful enough to change history, and Kaderin will do anything to win it for her sisters. Wanting only to win her, forever, Sebastian competes as well, taking every opportunity -- as they travel to ancient tombs and through catacombs, seeking relics around the world -- to use her new feelings to seduce her. But when forced to choose between the ampire she\'s falling for and reuniting her family, how can Kaderin live without either?	The Immortals After Dark, Book 2	Romance	''
Robyn Amos	Cosmic Rendezvous	5.99	3.00	1.50		Kimani	April 1, 2009	8	3	2		English	0373861087	978-0373861088	paperback	224	For Shelly London, relocating to Houston for a top secret space project could rock her world. Until the ambitious aerospace engineer collides with Lincoln Ripley. A hotshot astronaut, Lincoln is sexy, arrogant and a know-it-all, but he launches Shelly\'s hormones right into orbit.  Getting lost in space with the gorgeous wannabe astronaut could be the best thing that ever happened to Lincoln\'s flight path. Just as soon as he finds out who\'s trying to sabotage their spacecraft. Then Shelly better watch out, because now Lincoln has a double mission: to catch the culprit, then take off with Shelly for a rendezvous with love!	Kimani Romance	Romance	''
Richard Stoneman , Pseudo-Callisthenes (Translator)	The Greek Alexander Romance	9.89	4.95	2.47		Penguin Classics	November 5, 1991	0	0	0		English	0140445609	978-0140445602	paperback	197	Mystery surrounds the parentage of Alexander, the prince born to Queen Olympias. Is his father Philip, King of Macedonia, or Nectanebo, the mysterious sorcerer who seduced the queen by trickery? One thing is certain: the boy is destined to conquer the known world. He grows up to fulfil this prophecy, building a mighty empire that spans from Greece and Italy to Africa and Asia.  Begun soon after the real Alexander\'s death and expanded in the centuries that followed, \"The Greek Alexander Myth\" depicts the life and adventures of one of history\'s greatest heroes - taming the horse Bucephalus, meeting the Amazons and his quest to defeat the King of Persia. Including such elements of fantasy as Alexander\'s ascent to heaven borne by eagles, this literary masterpiece brilliantly evokes a lost age of heroism.	Penguin Classics	Romance	''
Adrianne Byrd	Two Grooms And A Wedding	5.99	3.00	1.50		Kimani	March 1, 2008	13	1	2		English	0373860560	978-0373860562	paperback	256	About last night Daughter of a prominent senator, ambitious Washington, D.C., attorney Isabella Kane has big dreams that include marriage to equally ambitious Randall Jarrett. But a funny thing happened on the way to the altar. She met a luscious hunk, and for just one forbidden night she followed her heart and indulged her deepest passions. But now she can\'t forget.  His mystery lady was gone by dawn, but political strategist Derrick Knight can\'t stop thinking about the irresistible woman he longs to see again. When she shows up as his fraternity brother\'s fiance, he\'s stunnedbut determined to stake his claim. He and Randall let a woman come between them once beforebut this time he won\'t back down. He wants Bella for his own bride!  Kappa Psi Kappathese brothers are for real!	Kimani Romance	Romance	''
Victoria Alexander	Love With the Proper Husband	7.99	4.00	2.00		Avon	March 25, 2003	6	0	1		English	0060001453	978-0060001452	paperback	384	Distressed over the current widespread disinterest inmatrimony among their eminently marriageable offspring, the formidable matriarchs of the ton have taken matters into their own meddling hands with the formation of The Ladies\' Society for the Betterment of the Future of Britain. Their first challenge: the Earl of Pennington.  Miss Gwendolyn Townsend has seen her late father\'s estate go to a distant cousin she can\'t abide ... leaving her well-educated, able to make a perfect curtsy -- and penniless. So imagine her shock when it\'s discovered that a match had been arranged between herself and Marcus Holcroft, the Earl of Pennington -- one of the most eligible members of London society. Marcus constantly leaves her breathless and confused ... and though she\'s hesitant to marry a man she\'s just met, in the end she has no choice. But she makes some conditions first ...  Marcus cannot believe that the bride who has been foisted upon him is insisting on rules to their wedding ...  and bedding! He\'s a man who has never had to tempt any woman into his arms. But even more surprising is that Gwendolyn is clearly hiding something -- and it shocks him to think that their exquisite kisses -- followed by his lessons in passionate lovemaking -- wouldn\'tbe enough to make his wife tell him her every secret. After all, he\'s promised to be a proper husband -- isnt it fair to also expect a proper wife?	''	Romance	''
Elaine Levine	Rachel And The Hired Gun	3.99	2.00	1.00		Zebra	January 6, 2009	3	0	0		English	1420105515	978-1420105513	paperback	352	When Rachel Douglas left her aunt\'s house in Virginia for the wilds of the Dakota territory, she knew the journey would be long and arduous.  But she didn\'t realize that she has been summoned west to be used as a pawn in a ranch war with her father\'s neighbor - or that her fierce, sudden attraction to Sager, her father\'s hired gun, would put her heart and her life in jeopardy.Seducing Rachel and feeding a bitter feud between the two ranches was Sager\'s plan of engeance against those who slaughtered his foster Shoshone family. Instead, Rachel\'s guileless mix of courage and ulnerability touches the conscience he thought he\'d buried long ago, and draws them both into a passion without rules, without limits - one that will change their destinies forever...	Zebra Historical Romance	Romance	''
Bernard Goldberg	A Slobbering Love Affair: The True	17.13	12.85	8.56	4.28	Regnery Publishing; First Printing edition	January 26, 2009	11	4	1	0	English	1596980907	978-1596980907	hardcover	184	New York Times bestselling author Bernard Goldberg argues that the left-leaning mainstream media crossed the line during the 2008 presidential election campaign and helped to determine the outcome. --This text refers to the Audio CD edition.	And Pathetic	Romance	''
Roslyn Hardy Holcomb	Try A Little Tenderness	10.79	5.39	2.70		Loose Id, LLC	September 26, 2008	8	2	0		English	1596328134	978-1596328136	paperback	284	Lola has a body made for sin and passion to match...	''	Romance	''
Marie Hake , Vickie McDonough	Virginia Brides: Spoke of Love/Spinning Out of Control/Weaving a Future	7.97	3.98	1.99		Barbour Publishing, Inc.	April 1, 2008	3	1	1		English	1597899895	978-1597899895	paperback	352	Historical Romance: The Shenandoah River Valley is full of romantic history that you will enjoy exploring along with the fictional Walsh family. Meet Garnet Wheelock whose indenture has been sold to a respectable widower. Sympathize with Amy Rogers who has lost all her family only to gain motherless children. Ride along with Sadie McEwan as harbored secrets bar the road to love. You relive a gentler time as love and faith are rooted in Virginian soil.	Heartsong Novella Collection	Romance	''
Kendra Leigh Castle	Dark Highland Fire	6.24	3.12	1.56		Sourcebooks Casablanca	October 1, 2008	7	0	0		English	1402211597	978-1402211591	paperback	400	Gabriel MacInnes has led a charmed life. A Highland werewolf of Alpha lineage, he\'d always thought that, as the second son, he would never have to worry much about responsibility. But with his Pack now squarely in the sights of an ancient and rediscovered enemy, everything has begun to change.	''	Romance	''
Hannah Howell	Only For You	6.99	3.50	1.75		Zebra	July 1, 2007	6	0	0		English	0821781510	978-0821781517	paperback	384	As wild as the rugged North Country where she was raised, Saxon Honey Todd has sworn to avenge the murder of her twin brother. Recklessly, she gallops across the English countryside in pursuit of the man she believes to be his murderer: Botolf, Earl of Regenford. As hard and unyielding as the armour he wears in battle, Botolf is irresistibly drawn to the impetuous beauty who has come to wage war with him. Saxon stirs his passion like no other woman has...Now as a desperate enemy stalks him and the greensward runs with innocent blood, Botolf brings Saxon to his castle...as his bride. But Saxon needs to fight by Botolf\'s side and triumph over the danger that surrounds them before she can surrender her heart completely to him...	Zebra Historical Romance	Romance	''
Melissa Mayhue	A Highlander of Her Own	6.99	3.50	1.75		Pocket	January 27, 2009	14	4	2		English	1416572597	978-1416572596	paperback	336	TEXAS, PRESENT DAY. Ellie Denton\'s world has spiraled out of control. A strange new birthmark, animals talking to her, and her mother\'s ex-husband laying claim to the family ranch have her thinking life can\'t get more complicated. But Ellie doesn\'t know the birthmark\'s connection to her Faerie ancestors. Complicated takes on a whole new meaning with her innocent wish to find her true love.  SCOTLAND, 1304. Caden MacAlister has more trouble than he can handle. With his brother held for ransom and the laird missing, the last thing he needs is another problem. But the Fae have other plans. A mysterious woman shows up in his stables, sent by Faerie Magic to find her true love. Fighting his attraction, Caden insists she\'s meant for one of his brothers. With his history, he has no desire for a woman in his life -- especially a woman sent by the Fae.  Only the magic of the Fae can determine whether Ellie will find a Highlander of her own...	Daughters of the Glen, Book 4	Romance	''
Susan Page Davis	Wyoming Brides: Protecting Amy/The Oregon Escort/Wyoming Hoofbeats	7.97	3.98	1.99		Barbour Publishing, Inc.	February 1, 2008	4	1	1		English	1597899860	978-1597899864	paperback	352	Historical Romance: Travel to the wilderness of the Old West without leaving your armchair, and experience the adventures of romance in the midst of dangerous pursuits. Meet Tom and Amy, who are fleeing potential kidnappers; Mike and Lydia, who struggle along a dangerous wagon train trail; and Matthew and Rachel, who risk disturbing peace with the Arapaho. Can these couples trust the Lord to preserve their love through the trials of life in the wilds of Wyoming?	Inspirational Romance Collection	Romance	''
